{
  "name": "ニュース多め番組",
  "description": "ディレクターが主要ニュース6件の進行表を作り、サブアナウンサーが1件ずつ読み、2件ごとにコメンテーターが短く解説する。天気・スポーツは扱わない。最後にディレクターが事実を点検する",
  "slots": {
    "director": {
      "description": "放送前に進行表を作り、放送後に事実点検をするディレクター",
      "count": "1"
    },
    "main_anchor": {
      "description": "オープニングとクロージングを担当するメインアナウンサー",
      "count": "1"
    },
    "sub_anchor": {
      "description": "ニュースを1件ずつ読み上げるサブアナウンサー",
      "count": "1"
    },
    "commentator": {
      "description": "2件ごとに短い解説を加えるコメンテーター",
      "count": "1"
    }
  },
  "phases": [
    {
      "type": "serial",
      "steps": [
        {
          "slot": "director",
          "action": "放送前。1行目に必ず『音声設定: OFF』と書き、取材フェーズは読み上げを停止して進行する。続けて、ユーザーの指定（日付・地域・テーマ）に沿って今日のニュースを調べ、取り上げる主要ニュースを6件、順番と各1行の要点つきで進行表にまとめる。政治・経済・社会・国際・科学技術など分野が偏らないようにし、天気とスポーツは入れない。進行表だけを出力し、挨拶や出演者への指示文は書かない"
        }
      ]
    },
    {
      "type": "serial",
      "steps": [
        {
          "slot": "director",
          "action": "本番開始前の音声設定確定。1行目に必ず『音声設定: ON』と書く。オフレコ継続の明示指示がある場合のみ『音声設定: OFF』を許可する"
        }
      ]
    },
    {
      "type": "serial",
      "steps": [
        {
          "slot": "main_anchor",
          "action": "オープニング。挨拶と日付を述べ、進行表の6件を見出しとして順に紹介し、1件目へ進める"
        },
        {
          "slot": "sub_anchor",
          "action": "進行表の1件目を原稿として読み上げる。報道機関名と日付を添え、未確認の点は未確認と言う。2〜4文、最大220文字で完結させ、途中で切らず句点で終える"
        },
        {
          "slot": "sub_anchor",
          "action": "進行表の2件目を原稿として読み上げる。報道機関名と日付を添え、未確認の点は未確認と言う。2〜4文、最大220文字で完結させ、途中で切らず句点で終える"
        },
        {
          "slot": "commentator",
          "action": "短縮版の解説。1件目と2件目のうち影響の大きい1件を選び、背景と影響範囲を2〜3文で話す。事実は出典を添え、影響範囲は予想と明示する。読み上げの繰り返しはしない"
        },
        {
          "slot": "sub_anchor",
          "action": "進行表の3件目を原稿として読み上げる。報道機関名と日付を添え、未確認の点は未確認と言う。2〜4文、最大220文字で完結させ、途中で切らず句点で終える"
        },
        {
          "slot": "sub_anchor",
          "action": "進行表の4件目を原稿として読み上げる。報道機関名と日付を添え、未確認の点は未確認と言う。2〜4文、最大220文字で完結させ、途中で切らず句点で終える"
        },
        {
          "slot": "commentator",
          "action": "短縮版の解説。3件目と4件目のうち影響の大きい1件を選び、背景と影響範囲を2〜3文で話す。事実は出典を添え、影響範囲は予想と明示する。読み上げの繰り返しはしない"
        },
        {
          "slot": "sub_anchor",
          "action": "進行表の5件目を原稿として読み上げる。報道機関名と日付を添え、未確認の点は未確認と言う。2〜4文、最大220文字で完結させ、途中で切らず句点で終える"
        },
        {
          "slot": "sub_anchor",
          "action": "進行表の6件目を原稿として読み上げる。報道機関名と日付を添え、未確認の点は未確認と言う。2〜4文、最大220文字で完結させ、途中で切らず句点で終える。情報不足の場合でも1文は必ず完成させ、『確認中のため続報待ちです。』で締める"
        },
        {
          "slot": "commentator",
          "action": "短縮版の解説。5件目と6件目のうち影響の大きい1件を選び、背景と影響範囲を2〜3文で話す。事実は出典を添え、影響範囲は予想と明示する。読み上げの繰り返しはしない。6件目の読み上げが欠落または不十分な場合は、その旨を先に述べたうえで5件目のみを解説対象にする"
        },
        {
          "slot": "main_anchor",
          "action": "クロージング。6件の要点を一言ずつ振り返り、番組を締める"
        }
      ]
    },
    {
      "type": "serial",
      "steps": [
        {
          "slot": "director",
          "action": "放送後の点検。放送内の事実・数字・出典を確認し、出典のない断定や確認できない主張を箇条書きで指摘する。問題がなければ『点検結果：問題なし』とだけ書く"
        }
      ]
    }
  ]
}