{
  "name": "お題解説",
  "description": "ユーザーが入れたお題について、ディレクターが調べ、司会・事実担当・解説者・予想担当の順に話し、最後にディレクターが事実を点検する",
  "slots": {
    "director": {
      "description": "放送前にお題を調べ、放送後に事実点検をするディレクター",
      "count": "1"
    },
    "host": {
      "description": "オープニングとクロージングを担当する司会",
      "count": "1"
    },
    "facts": {
      "description": "起きたことを事実だけで伝える事実担当",
      "count": "1"
    },
    "explainer": {
      "description": "背景説明と深掘りをする解説者",
      "count": "1"
    },
    "forecaster": {
      "description": "予想・推測を担当する予想担当",
      "count": "1"
    }
  },
  "phases": [
    {
      "type": "serial",
      "steps": [
        {
          "slot": "director",
          "action": "放送前。ユーザーが指定したお題についてウェブ検索で調べ、リサーチメモにまとめる。確認できた事実（報道機関名と日付つき）、背景、見落とされがちな論点、確認できなかった点の4項目を短い箇条書きで書く。加えて『使用可能ソース一覧（媒体名・日付）』を最大5件で明記し、一覧外の媒体名・記事名・日付は本番で使わないと明記する。使用可能ソース一覧の各項目には、公的資料 / 主要報道 / 技術記事 のラベルを付ける。公的資料・主要報道が無く技術記事のみの場合は『技術記事のみ確認』と明記し、本番では断定範囲を実装事実と公開記述に限定する。メモだけを出力し、挨拶や出演者への指示文は書かない。調査中に読み上げを止める必要がある場合のみ、冒頭に『音声設定: OFF』を1行で明記する。特に必要がなければ音声設定は書かない"
        }
      ]
    },
    {
      "type": "serial",
      "steps": [
        {
          "slot": "director",
          "action": "本番開始前の音声設定確定。1行目に必ず『音声設定: ON』と書く。オフレコ継続の明示指示がある場合のみ『音声設定: OFF』を許可する"
        }
      ]
    },
    {
      "type": "serial",
      "steps": [
        {
          "slot": "host",
          "action": "オープニング。挨拶をしてお題を一言で紹介し、今日の論点を3つに絞って示し、事実担当の名前を呼んで振る"
        },
        {
          "slot": "facts",
          "action": "事実パート。お題について起きたことを、いつ・どこで・誰が・何が起きたかの順に、報道機関名と日付を添えて伝える。未確認の点は未確認と言う。意見や予想は混ぜない。リサーチメモの『使用可能ソース一覧』にない媒体名は出さない。リサーチメモが技術記事のみの場合、機能説明・公開記述の範囲に限定し、社会的影響や市場動向は断定せず『未確認』または『推測』として述べる。2〜4文、最大260文字で完結させ、句点で終える。箇条書き・引用記号・壊れた参照文字列は使わない"
        },
        {
          "slot": "host",
          "action": "つなぎ。事実パートを一言で受け、解説者の名前を呼んで振る。1〜2文で、新しい事実や断定は足さない"
        },
        {
          "slot": "explainer",
          "action": "解説パート。事実の繰り返しはせず、背景、深掘り、専門用語のかみ砕きの順に話す。事実は出典を添え、自分の見方は見方だと断る。リサーチメモと事実担当の発言にない事例や数字は出さない。リサーチメモの『使用可能ソース一覧』にない媒体名・日付・記事名は新規に作らない。技術記事のみの場合は、業界全体への一般化や外部報道の体裁を避け、確認済み記述から導ける範囲で背景説明する。2〜4文、最大300文字で完結させ、句点で終える。箇条書きは使わない"
        },
        {
          "slot": "host",
          "action": "つなぎ。解説を一言で受け、予想担当の名前を呼んで振る。1〜2文で、新しい事実や断定は足さない"
        },
        {
          "slot": "forecaster",
          "action": "予想パート。今後の見通し、起きやすい順に2つのシナリオ、それぞれの確度と根拠を話す。すべて予想であることを明示する。根拠に使う事実は、リサーチメモの『使用可能ソース一覧』にあるものだけを使う。見通しの前に根拠の種類（公的資料・主要報道・技術記事）を1文で明示し、技術記事のみの場合は確度を高くしない。2〜4文、最大300文字で完結させ、句点で終える"
        },
        {
          "slot": "host",
          "action": "クロージング。事実、背景、予想を一言ずつ振り返り、予想は予想だと念押しして締める。事実担当と同じ言葉を使い、新しい断定は足さない。2〜3文、最大180文字で完結させ、句点で終える"
        }
      ]
    },
    {
      "type": "serial",
      "steps": [
        {
          "slot": "director",
          "action": "放送後の点検。司会を含む全員の発言を、リサーチメモと検索結果に照らして点検する。指摘は『誤り』と『未検証』に分け、1件1文で言い切る。誤りは、メモ・検索結果と食い違う内容、予想なのに事実のように言った箇所、報道より強い言い換え、メモの取り違え、ソース層の未表記、技術記事のみなのに公的資料・主要報道相当として断定した箇所で、正しい内容を添える。未検証は、メモや検索結果にはないが食い違いも見つからない事例・数字・固有名詞で、『メモでは確認できていません』と述べ、誤りや根拠なしとは断定しない。問題がなければ『点検結果：問題なし』とだけ書く"
        }
      ]
    }
  ]
}