{
  "name": "ニュース番組",
  "description": "ディレクターが進行表を作り、アナウンサー・コメンテーター・天気・スポーツの順に放送し、最後にディレクターが事実を点検する",
  "slots": {
    "director": {
      "description": "放送前に進行表を作り、放送後に事実点検をするディレクター",
      "count": "1"
    },
    "main_anchor": {
      "description": "オープニングとクロージングを担当するメインアナウンサー",
      "count": "1"
    },
    "sub_anchor": {
      "description": "ニュースを読み上げるサブアナウンサー",
      "count": "1"
    },
    "commentator": {
      "description": "ニュースに解説とコメントを加えるコメンテーター",
      "count": "1"
    },
    "weather": {
      "description": "お天気担当",
      "count": "1"
    },
    "sports": {
      "description": "スポーツ担当",
      "count": "1"
    }
  },
  "phases": [
    {
      "type": "serial",
      "steps": [
        {
          "slot": "director",
          "action": "事前取材。1行目に必ず『音声設定: OFF』と書き、取材・突合フェーズは読み上げを停止して進行する。続けて、ユーザーの指定（日付・地域・テーマ）に沿って主要候補を調査し、2件に絞る。各件について、見出し案、根拠ソース（媒体名・日付）、確認できた事実、未確認事項を取材メモとして箇条書きでまとめる"
        }
      ]
    },
    {
      "type": "serial",
      "steps": [
        {
          "slot": "sub_anchor",
          "action": "ソース突合。ディレクターの取材メモにある2件について、各1〜2件の補助ソースを確認し、ディレクター案と一致する事実・不一致の点・未確認事項を短く整理する。断定はせず、媒体名と日付を必ず添える。このフェーズはディレクター向けの突合結果のみを出力し、放送原稿・挨拶・見出しは作らない。出力は1トピック最大4行、全体で300文字以内にする"
        },
        {
          "slot": "commentator",
          "action": "解説準備のための補助ソース提示。2件のうち影響が大きいと考える1件を選び、背景確認に使う補助ソースを1〜2件だけ示す。事実と予想を分け、予想は予想と明示する。このフェーズは補助ソース提示のみを出力し、放送用の言い回しは作らない。出力は最大3行、200文字以内にする"
        }
      ]
    },
    {
      "type": "serial",
      "steps": [
        {
          "slot": "director",
          "action": "ソース事前確認。直前フェーズの突合結果を確認し、放送で使う『確定ソース一覧』を各トピックごとに決定する。採用理由・不採用理由・未確認事項を簡潔に記す"
        }
      ]
    },
    {
      "type": "serial",
      "steps": [
        {
          "slot": "director",
          "action": "原稿まとめ。取材メモと確定ソース一覧をもとに、放送用の下書きを作る。2件それぞれについて、読み上げ用の短い本文、未確認時の留保表現、差し替え候補の一文を用意する"
        }
      ]
    },
    {
      "type": "serial",
      "steps": [
        {
          "slot": "director",
          "action": "放送前。直前の取材メモと原稿下書きを踏まえて、取り上げる主要ニュースを2件、順番と各1行の要点つきで最終進行表にまとめる。進行表だけを出力し、挨拶や出演者への指示文は書かない"
        },
        {
          "slot": "director",
          "action": "放送用確定原稿の固定。最終進行表と確定ソース一覧に基づき、1件目と2件目のサブアナウンサー用本文を各2〜3文で確定する。ここでは放送で読み上げる本文だけを出力し、突合メモ・未採用理由・作業メモは書かない"
        },
        {
          "slot": "director",
          "action": "本番開始前の音声設定確定。1行目に必ず『音声設定: ON』と書く。オフレコを継続する明示指示がある場合のみ『音声設定: OFF』を許可する"
        }
      ]
    },
    {
      "type": "serial",
      "steps": [
        {
          "slot": "main_anchor",
          "action": "オープニング。挨拶と日付を述べ、進行表の2件を見出しとして紹介し、各コーナーへ進める"
        },
        {
          "slot": "sub_anchor",
          "action": "進行表の1件目を、ディレクターが直前に固定した放送用確定原稿に沿って読み上げる。突合メモ、取材メモ、未採用理由、作業メモは一切読み上げない。本文のみを自然な話し言葉で出力し、見出し・箇条書き・Markdown記号は使わない"
        },
        {
          "slot": "sub_anchor",
          "action": "進行表の2件目を、ディレクターが直前に固定した放送用確定原稿に沿って読み上げる。突合メモ、取材メモ、未採用理由、作業メモは一切読み上げない。本文のみを自然な話し言葉で出力し、見出し・箇条書き・Markdown記号は使わない"
        },
        {
          "slot": "commentator",
          "action": "読み上げられた2件のうち、より影響の大きい1件を選んで解説する。背景の詳細、深掘り、展開予想、影響範囲の順に話す。事実は確定ソース一覧を優先して出典を添え、展開予想と影響範囲は予想と明示する。確定ソース外の事実を使う場合は未確認として扱う。読み上げの繰り返しはしない"
        },
        {
          "slot": "weather",
          "action": "お天気コーナー。今日と明日の天気と注意点を伝える"
        },
        {
          "slot": "sports",
          "action": "スポーツコーナー。直近の主な結果と話題を伝える"
        },
        {
          "slot": "main_anchor",
          "action": "クロージング。各コーナーの要点を一言ずつ振り返り、番組を締める"
        }
      ]
    },
    {
      "type": "serial",
      "steps": [
        {
          "slot": "director",
          "action": "放送後の点検。放送内の事実・数字・出典を確認し、出典のない断定や確認できない主張を箇条書きで指摘する。問題がなければ『点検結果：問題なし』とだけ書く"
        }
      ]
    }
  ]
}