{
  "name": "お題解説",
  "description": "ユーザーが入れたお題について、ディレクターが調べ、司会・事実担当・解説者・予想担当の順に話し、最後にディレクターが事実を点検する",
  "slots": {
    "director": {
      "description": "放送前にお題を調べ、放送後に事実点検をするディレクター",
      "count": "1"
    },
    "host": {
      "description": "オープニングとクロージングを担当する司会",
      "count": "1"
    },
    "facts": {
      "description": "起きたことを事実だけで伝える事実担当",
      "count": "1"
    },
    "explainer": {
      "description": "背景説明と深掘りをする解説者",
      "count": "1"
    },
    "forecaster": {
      "description": "予想・推測を担当する予想担当",
      "count": "1"
    }
  },
  "phases": [
    {
      "type": "serial",
      "steps": [
        {
          "slot": "director",
          "action": "放送前。ユーザーが指定したお題についてウェブ検索で調べ、リサーチメモにまとめる。確認できた事実（報道機関名と日付つき）、背景、見落とされがちな論点、確認できなかった点の4項目を短い箇条書きで書く。メモだけを出力し、挨拶や出演者への指示文は書かない"
        }
      ]
    },
    {
      "type": "serial",
      "steps": [
        {
          "slot": "host",
          "action": "オープニング。挨拶をしてお題を一言で紹介し、今日の論点を3つに絞って示し、事実担当の名前を呼んで振る"
        },
        {
          "slot": "facts",
          "action": "事実パート。お題について起きたことを、いつ・どこで・誰が・何が起きたかの順に、報道機関名と日付を添えて伝える。未確認の点は未確認と言う。意見や予想は混ぜない"
        },
        {
          "slot": "host",
          "action": "つなぎ。事実パートを一言で受け、解説者の名前を呼んで振る。1〜2文で、新しい事実や断定は足さない"
        },
        {
          "slot": "explainer",
          "action": "解説パート。事実の繰り返しはせず、背景、深掘り、専門用語のかみ砕きの順に話す。事実は出典を添え、自分の見方は見方だと断る。リサーチメモと事実担当の発言にない事例や数字は出さない"
        },
        {
          "slot": "host",
          "action": "つなぎ。解説を一言で受け、予想担当の名前を呼んで振る。1〜2文で、新しい事実や断定は足さない"
        },
        {
          "slot": "forecaster",
          "action": "予想パート。今後の見通し、起きやすい順に2つのシナリオ、それぞれの確度と根拠を話す。すべて予想であることを明示する"
        },
        {
          "slot": "host",
          "action": "クロージング。事実、背景、予想を一言ずつ振り返り、予想は予想だと念押しして締める。事実担当と同じ言葉を使い、新しい断定は足さない"
        }
      ]
    },
    {
      "type": "serial",
      "steps": [
        {
          "slot": "director",
          "action": "放送後の点検。司会を含む全員の発言を、リサーチメモと検索結果に照らして点検する。出典のない断定、メモにない事例や数字、予想なのに事実のように言った箇所、報道より強い言い換え、メモの取り違えを、1件1文で言い切る形で指摘し、誤りには正しい内容を添える。問題がなければ『点検結果：問題なし』とだけ書く"
        }
      ]
    }
  ]
}
