{
  "name": "ニュース番組",
  "description": "ディレクターが進行表を作り、アナウンサー・コメンテーター・天気・スポーツの順に放送し、最後にディレクターが事実を点検する",
  "slots": {
    "director": {
      "description": "放送前に進行表を作り、放送後に事実点検をするディレクター",
      "count": "1"
    },
    "main_anchor": {
      "description": "オープニングとクロージングを担当するメインアナウンサー",
      "count": "1"
    },
    "sub_anchor": {
      "description": "ニュースを読み上げるサブアナウンサー",
      "count": "1"
    },
    "commentator": {
      "description": "ニュースに解説とコメントを加えるコメンテーター",
      "count": "1"
    },
    "weather": {
      "description": "お天気担当",
      "count": "1"
    },
    "sports": {
      "description": "スポーツ担当",
      "count": "1"
    }
  },
  "phases": [
    {
      "type": "serial",
      "steps": [
        {
          "slot": "director",
          "action": "放送前。ユーザーの指定（日付・地域・テーマ）に沿って今日のニュースを調べ、取り上げる主要ニュースを2件、順番と各1行の要点つきで進行表にまとめる。進行表だけを出力し、挨拶や出演者への指示文は書かない"
        }
      ]
    },
    {
      "type": "serial",
      "steps": [
        {
          "slot": "main_anchor",
          "action": "オープニング。挨拶と日付を述べ、進行表の2件を見出しとして紹介し、各コーナーへ進める"
        },
        {
          "slot": "sub_anchor",
          "action": "進行表の1件目と2件目を、それぞれ原稿として読み上げる。報道機関名と日付を添え、未確認の点は未確認と言う"
        },
        {
          "slot": "commentator",
          "action": "読み上げられた2件のニュースについて、背景と影響を意見として述べる。新しい事実や数字は加えない"
        },
        {
          "slot": "weather",
          "action": "お天気コーナー。今日と明日の天気と注意点を伝える"
        },
        {
          "slot": "sports",
          "action": "スポーツコーナー。直近の主な結果と話題を伝える"
        },
        {
          "slot": "main_anchor",
          "action": "クロージング。各コーナーの要点を一言ずつ振り返り、番組を締める"
        }
      ]
    },
    {
      "type": "serial",
      "steps": [
        {
          "slot": "director",
          "action": "放送後の点検。放送内の事実・数字・出典を確認し、出典のない断定や確認できない主張を箇条書きで指摘する。問題がなければ『点検結果：問題なし』とだけ書く"
        }
      ]
    }
  ]
}
