{
  "name": "出典確認付き討議",
  "description": "参加者が意見を述べ、ソース確認役が問い、回答を経て確認完了まで反復する（サンプル）",
  "slots": {
    "participant": {
      "description": "議論参加者",
      "count": "1+"
    },
    "source_checker": {
      "description": "出典・根拠の確認担当",
      "count": "1"
    }
  },
  "phases": [
    {
      "type": "loop",
      "max_iterations": 3,
      "exit": {
        "type": "marker",
        "marker": "【確認完了】"
      },
      "phases": [
        {
          "type": "serial",
          "steps": [
            {
              "slot": "participant",
              "action": "初回: 議題について意見を述べる。数値・統計は出典または要確認を添える。2回目以降: 直前の「ソースは？」への回答のみ。各質問は (A) 確認できたURLまたは正式資料名を1件提示 (B) 当該事実主張を取り下げ、仮説・懸念・意見に格下げする（『要確認・再調査予定』だけでは答えにならない）。格下げ時は『〜の可能性がある（出典なし）』の形で書き直す。新しい事実主張は追加しない"
            }
          ]
        },
        {
          "type": "serial",
          "steps": [
            {
              "slot": "source_checker",
              "action": "--- 前の発言 --- の表示名（ひなた・かえで等。IDは使わない）で呼びかける。事実・数値・引用について、(1)出典がない (2)機関名と年だけで具体性が不足しているものに「ソースは？」と短く問う。初回から要確認と明記済みの項目は質問しない。『要確認・再調査予定』だけの返答は未回答とみなし、出典提示か主張の取り下げを求める。URL・資料名提示済み、または取り下げ・格下げ済みの項目は再質問しない。意見・推奨は対象外。未回答がなく、事実として残る無出典主張がなければ【確認完了】と理由1文のみ"
            }
          ]
        }
      ]
    }
  ]
}
