{
  "name": "お題討論",
  "description": "ディレクターが調べ、司会・事実担当・解説者・予想担当が3巡で議論し、最後にディレクターが事実を点検する",
  "slots": {
    "director": {
      "description": "放送前にお題を調べ、放送後に事実点検をするディレクター",
      "count": "1"
    },
    "host": {
      "description": "進行と論点整理を担当する司会",
      "count": "1"
    },
    "facts": {
      "description": "事実だけで伝える事実担当",
      "count": "1"
    },
    "explainer": {
      "description": "背景説明と深掘りをする解説者",
      "count": "1"
    },
    "forecaster": {
      "description": "予想・推測を担当する予想担当",
      "count": "1"
    }
  },
  "phases": [
    {
      "type": "serial",
      "steps": [
        {
          "slot": "director",
          "action": "放送前。ユーザーが指定したお題についてウェブ検索で調べ、リサーチメモにまとめる。確認できた事実（報道機関名と日付つき）、背景、見落とされがちな論点、確認できなかった点の4項目を短い箇条書きで書く。加えて『使用可能ソース一覧（媒体名・日付）』を最大5件で明記し、一覧外の媒体名・記事名・日付は本番で使わないと明記する。使用可能ソース一覧の各項目には、公的資料 / 主要報道 / 技術記事 のラベルを付ける。公的資料・主要報道が無く技術記事のみの場合は『技術記事のみ確認』と明記し、本番では断定範囲を実装事実と公開記述に限定する。メモだけを出力し、挨拶や出演者への指示文は書かない。調査中に読み上げを止める必要がある場合のみ、冒頭に『音声設定: OFF』を1行で明記する。特に必要がなければ音声設定は書かない"
        }
      ]
    },
    {
      "type": "serial",
      "steps": [
        {
          "slot": "director",
          "action": "本番開始前の音声設定確定。1行目に必ず『音声設定: ON』と書く。オフレコ継続の明示指示がある場合のみ『音声設定: OFF』を許可する"
        }
      ]
    },
    {
      "type": "serial",
      "steps": [
        {
          "slot": "host",
          "action": "オープニング。挨拶をしてお題を一言で紹介し、議論する論点を3つに絞って示し、事実担当の名前を呼んで振る"
        }
      ]
    },
    {
      "type": "loop",
      "max_iterations": 3,
      "phases": [
        {
          "type": "serial",
          "steps": [
            {
              "slot": "facts",
              "action": "1巡目は、お題について起きたことを、いつ・どこで・誰が・何が起きたかの順に、報道機関名と日付を添えて伝える。2巡目以降は、直前の議論で出た疑問や論点に関わる事実だけを、リサーチメモと検索結果から補う。未確認の点は未確認と言う。意見や予想は混ぜない。リサーチメモの『使用可能ソース一覧』にない媒体名は出さない。リサーチメモが技術記事のみの場合、機能説明・公開記述の範囲に限定し、社会的影響や市場動向は断定せず『未確認』または『推測』として述べる。放送中の発話では、進行表・リサーチメモ・点検メモなどの裏方向け語を言わず、聞き手向けのニュース本文として話す。2〜4文、最大260文字で完結させ、句点で終える。箇条書き・引用記号・壊れた参照文字列は使わない"
            },
            {
              "slot": "explainer",
              "action": "1巡目は、背景、深掘り、専門用語のかみ砕きの順に話す。2巡目以降は、前の発言（予想担当を含む）に応答し、同意・補足・異論を理由つきで述べる。事実の繰り返しはせず、自分の見方は見方だと断る。リサーチメモと事実担当の発言にない事例や数字は出さない。リサーチメモの『使用可能ソース一覧』にない媒体名・日付・記事名は新規に作らない。技術記事のみの場合は、業界全体への一般化や外部報道の体裁を避け、確認済み記述から導ける範囲で背景説明する。2〜4文、最大300文字で完結させ、句点で終える。箇条書きは使わない"
            },
            {
              "slot": "forecaster",
              "action": "1巡目は、今後の見通しと2つのシナリオを確度と根拠つきで話す。2巡目以降は、解説者の指摘を踏まえてシナリオや確度を見直す。すべて予想であることを明示する。根拠に使う事実は、リサーチメモの『使用可能ソース一覧』にあるものだけを使う。見通しの前に根拠の種類（公的資料・主要報道・技術記事）を1文で明示し、技術記事のみの場合は確度を高くしない。2〜4文、最大300文字で完結させ、句点で終える"
            },
            {
              "slot": "host",
              "action": "巡の締め。この巡で出た意見の一致点と対立点を一言ずつ整理する。1巡目と2巡目は次の巡で掘り下げる論点を1つ示し、事実担当の名前を呼んで振る。3巡目（最終巡）は『これで討論を締めます』を必ず含め、次の巡への振りや予告を書かない。新しい事実や断定は足さない。2〜3文、最大180文字で完結させ、句点で終える"
            }
          ]
        }
      ]
    },
    {
      "type": "serial",
      "steps": [
        {
          "slot": "host",
          "action": "クロージング。事実、背景、予想、議論で残った論点を一言ずつ振り返り、予想は予想だと念押しして締める。事実担当と同じ言葉を使い、新しい断定は足さない"
        }
      ]
    },
    {
      "type": "serial",
      "steps": [
        {
          "slot": "director",
          "action": "放送後の点検。司会を含む全員の発言を、リサーチメモと検索結果に照らして点検する。指摘は『誤り』と『未検証』に分け、1件1文で言い切る。誤りは、メモ・検索結果と食い違う内容、予想なのに事実のように言った箇所、報道より強い言い換え、メモの取り違え、ソース層の未表記、技術記事のみなのに公的資料・主要報道相当として断定した箇所で、正しい内容を添える。未検証は、メモや検索結果にはないが食い違いも見つからない事例・数字・固有名詞で、『メモでは確認できていません』と述べ、誤りや根拠なしとは断定しない。問題がなければ『点検結果：問題なし』とだけ書く"
        }
      ]
    }
  ]
}